{
  "schema_version": "1.0.0",
  "package_version": "1.0.0",
  "target_framework": "VCGF",
  "target_framework_version": "1.3.0",
  "status": "final-integration-candidate",
  "activation_semantics": "explicit-composition-signals-only; one-primary-at-most-plus-explicit-modifiers; does-not-auto-activate-components-or-interactions",
  "compositions": [
    {
      "id": "VCGF-UI-SCR-001",
      "composition": "DashboardOverview",
      "title": "لوحة النظرة العامة الذكية",
      "kind": "primary",
      "priority": "P1",
      "version": "0.5.0",
      "status": "final-integration-candidate",
      "path": "screen-compositions/VCGF-UI-SCR-001-DashboardOverview.md",
      "purpose": "تقديم صورة موجزة وقابلة للتصرف عن الحالة الحالية والاتجاهات والاستثناءات دون تحويل الصفحة إلى مستودع رسوم ومؤشرات.",
      "applies_when": "عندما تكون المهمة الأساسية فهم الحالة العامة أو مراقبة مؤشرات مختارة ثم الانتقال إلى التفاصيل أو الإجراء.",
      "not_applicable_when": "لا تستخدم بدل شاشة تشغيلية عالية الكثافة أو تقرير تحليلي عميق أو قائمة سجلات تحتاج فرزًا وتحديدًا جماعيًا.",
      "triggers": [
        "dashboard_overview",
        "executive_summary",
        "kpi_overview"
      ],
      "review_components": [
        "VCGF-UI-COMP-020",
        "VCGF-UI-COMP-008",
        "VCGF-UI-COMP-009"
      ],
      "review_interactions": [
        "VCGF-UI-INT-003",
        "VCGF-UI-INT-009",
        "VCGF-UI-INT-010"
      ],
      "structure_summary": "ملخص رئيسي محدود، مؤشرات ذات معنى، استثناءات قابلة للتصرف، ثم روابط واضحة إلى التفاصيل.",
      "responsive_summary": "على الهاتف تتحول الوحدات إلى تسلسل رأسي حسب الأولوية؛ على الشاشة الكبيرة لا تستخدم المساحة لإضافة مؤشرات بلا قيمة، بل لتحسين المقارنة والسياق.",
      "policies": [
        {
          "key": "densityPolicy",
          "type": "string",
          "default": "adaptive",
          "scope": "system/tenant/user",
          "constraints": "adaptive أو comfortable أو compact ضمن حدود الوصولية ولا يغيّر صلاحيات أو بيانات."
        },
        {
          "key": "primaryActionLimit",
          "type": "integer",
          "default": 1,
          "scope": "system/tenant",
          "constraints": "عدد الإجراءات الأساسية المرئية في المنطقة الواحدة؛ أي استثناء يبرر بالمهمة."
        },
        {
          "key": "progressiveDisclosure",
          "type": "boolean",
          "default": true,
          "scope": "system/tenant",
          "constraints": "يخفي التعقيد الثانوي لا المعلومات اللازمة لاتخاذ القرار أو إكمال المهمة."
        },
        {
          "key": "mobileTransform",
          "type": "string",
          "default": "task-preserving-reflow",
          "scope": "system/tenant",
          "constraints": "reflow أو list-detail أو stacked-panels حسب العقد؛ لا تصغير حرفي لسطح المكتب."
        },
        {
          "key": "largeScreenTransform",
          "type": "string",
          "default": "context-expansion",
          "scope": "system/tenant",
          "constraints": "توسيع السياق أو المقارنة بدل تمديد الحقول/النص بلا حدود."
        },
        {
          "key": "roleAdaptation",
          "type": "string",
          "default": "priority-only",
          "scope": "system/tenant",
          "constraints": "يغير ترتيب/إبراز المعلومات المصرح بها فقط؛ لا يمنح ولا يسحب صلاحية ولا يغير حقيقة الأعمال."
        }
      ],
      "requirement_count": 12,
      "acceptance_count": 12
    },
    {
      "id": "VCGF-UI-SCR-002",
      "composition": "OperationalCollection",
      "title": "قائمة التشغيل وإدارة السجلات",
      "kind": "primary",
      "priority": "P0",
      "version": "0.5.0",
      "status": "final-integration-candidate",
      "path": "screen-compositions/VCGF-UI-SCR-002-OperationalCollection.md",
      "purpose": "تمكين المستخدم من العثور على مجموعة سجلات وتشغيلها بسرعة مع فرز وتصفية وانتقاء وإجراءات ضمن نطاق واضح.",
      "applies_when": "عندما تكون المهمة الأساسية إدارة مجموعة سجلات أو طلبات أو عناصر عمل قابلة للبحث والتصفية.",
      "not_applicable_when": "لا تستخدم عندما يكون الهدف قراءة سجل واحد أو تنفيذ عملية موجهة خطوة بخطوة.",
      "triggers": [
        "collection_management",
        "records_browse",
        "operational_list"
      ],
      "review_components": [
        "VCGF-UI-COMP-002",
        "VCGF-UI-COMP-026",
        "VCGF-UI-COMP-004",
        "VCGF-UI-COMP-031"
      ],
      "review_interactions": [
        "VCGF-UI-INT-013",
        "VCGF-UI-INT-021",
        "VCGF-UI-INT-024"
      ],
      "structure_summary": "عنوان وسياق، بحث/فلاتر، تمثيل مجموعة مناسب، إجراءات فردية أو جماعية، Pagination أو تحميل تدريجي موثق.",
      "responsive_summary": "على الهاتف يختار النظام البطاقات أو القائمة أو جدولًا مبسطًا بحسب المهمة؛ لا يضغط جدول سطح المكتب قسرًا داخل عرض ضيق.",
      "policies": [
        {
          "key": "densityPolicy",
          "type": "string",
          "default": "adaptive",
          "scope": "system/tenant/user",
          "constraints": "adaptive أو comfortable أو compact ضمن حدود الوصولية ولا يغيّر صلاحيات أو بيانات."
        },
        {
          "key": "primaryActionLimit",
          "type": "integer",
          "default": 1,
          "scope": "system/tenant",
          "constraints": "عدد الإجراءات الأساسية المرئية في المنطقة الواحدة؛ أي استثناء يبرر بالمهمة."
        },
        {
          "key": "progressiveDisclosure",
          "type": "boolean",
          "default": true,
          "scope": "system/tenant",
          "constraints": "يخفي التعقيد الثانوي لا المعلومات اللازمة لاتخاذ القرار أو إكمال المهمة."
        },
        {
          "key": "mobileTransform",
          "type": "string",
          "default": "task-preserving-reflow",
          "scope": "system/tenant",
          "constraints": "reflow أو list-detail أو stacked-panels حسب العقد؛ لا تصغير حرفي لسطح المكتب."
        },
        {
          "key": "largeScreenTransform",
          "type": "string",
          "default": "context-expansion",
          "scope": "system/tenant",
          "constraints": "توسيع السياق أو المقارنة بدل تمديد الحقول/النص بلا حدود."
        },
        {
          "key": "roleAdaptation",
          "type": "string",
          "default": "priority-only",
          "scope": "system/tenant",
          "constraints": "يغير ترتيب/إبراز المعلومات المصرح بها فقط؛ لا يمنح ولا يسحب صلاحية ولا يغير حقيقة الأعمال."
        }
      ],
      "requirement_count": 12,
      "acceptance_count": 12
    },
    {
      "id": "VCGF-UI-SCR-003",
      "composition": "RecordWorkspace",
      "title": "مساحة عمل السجل",
      "kind": "primary",
      "priority": "P0",
      "version": "0.5.0",
      "status": "final-integration-candidate",
      "path": "screen-compositions/VCGF-UI-SCR-003-RecordWorkspace.md",
      "purpose": "جمع هوية السجل وحالته وحقوله وإجراءاته وعلاقاته المهمة في مساحة يمكن فهمها واتخاذ قرار منها.",
      "applies_when": "عندما يكون المستخدم متمركزًا حول سجل أو معاملة واحدة ويحتاج القراءة أو الإجراء أو الانتقال إلى سياقات مرتبطة.",
      "not_applicable_when": "لا تستخدم بدل نموذج إنشاء جديد بسيط أو قائمة سجلات.",
      "triggers": [
        "record_workspace",
        "record_detail_screen",
        "entity_workspace"
      ],
      "review_components": [
        "VCGF-UI-COMP-025",
        "VCGF-UI-COMP-031",
        "VCGF-UI-COMP-027",
        "VCGF-UI-COMP-028"
      ],
      "review_interactions": [
        "VCGF-UI-INT-003",
        "VCGF-UI-INT-024",
        "VCGF-UI-INT-017"
      ],
      "structure_summary": "رأس هوية وحالة، حقائق أساسية، مناطق ثانوية قابلة للطي، إجراءات حسب الصلاحية، ونشاط/علاقات عند الحاجة.",
      "responsive_summary": "على الهاتف تقدّم المعلومات الأساسية والإجراءات المهمة قبل المناطق الثانوية؛ وعلى الشاشات الواسعة يمكن استخدام تقسيم سياقي دون تشتيت.",
      "policies": [
        {
          "key": "densityPolicy",
          "type": "string",
          "default": "adaptive",
          "scope": "system/tenant/user",
          "constraints": "adaptive أو comfortable أو compact ضمن حدود الوصولية ولا يغيّر صلاحيات أو بيانات."
        },
        {
          "key": "primaryActionLimit",
          "type": "integer",
          "default": 1,
          "scope": "system/tenant",
          "constraints": "عدد الإجراءات الأساسية المرئية في المنطقة الواحدة؛ أي استثناء يبرر بالمهمة."
        },
        {
          "key": "progressiveDisclosure",
          "type": "boolean",
          "default": true,
          "scope": "system/tenant",
          "constraints": "يخفي التعقيد الثانوي لا المعلومات اللازمة لاتخاذ القرار أو إكمال المهمة."
        },
        {
          "key": "mobileTransform",
          "type": "string",
          "default": "task-preserving-reflow",
          "scope": "system/tenant",
          "constraints": "reflow أو list-detail أو stacked-panels حسب العقد؛ لا تصغير حرفي لسطح المكتب."
        },
        {
          "key": "largeScreenTransform",
          "type": "string",
          "default": "context-expansion",
          "scope": "system/tenant",
          "constraints": "توسيع السياق أو المقارنة بدل تمديد الحقول/النص بلا حدود."
        },
        {
          "key": "roleAdaptation",
          "type": "string",
          "default": "priority-only",
          "scope": "system/tenant",
          "constraints": "يغير ترتيب/إبراز المعلومات المصرح بها فقط؛ لا يمنح ولا يسحب صلاحية ولا يغير حقيقة الأعمال."
        }
      ],
      "requirement_count": 12,
      "acceptance_count": 12
    },
    {
      "id": "VCGF-UI-SCR-004",
      "composition": "FormTransaction",
      "title": "شاشة النموذج والمعاملة",
      "kind": "primary",
      "priority": "P0",
      "version": "0.5.0",
      "status": "final-integration-candidate",
      "path": "screen-compositions/VCGF-UI-SCR-004-FormTransaction.md",
      "purpose": "تنظيم إدخال أو تعديل بيانات مع تحقق واضح وتسلسل منطقي وإجراءات حفظ/إرسال لا تربك المستخدم.",
      "applies_when": "عندما تكون المهمة الأساسية إنشاء أو تعديل كيان أو طلب ضمن نموذج واحد قابل للإكمال دون Wizard حقيقي.",